Reading OpenROAD database at '/home/g/my_designs/eth_phy_1g/runs/RUN_2026-02-12_20-25-23/34-openroad-globalrouting/eth_phy_1g.odb'…
Reading library file at '/home/g/.volare/volare/sky130/versions/0fe599b2afb6708d281543108caf8310912f54af/sky130A/libs.ref/sky130_fd_sc_hd/lib/sky130_fd_sc_hd__tt_025C_1v80.lib'…
Reading design constraints file at '/nix/store/h0ldzjka94yryiq8yxbxmwargpnmwhx6-python3-3.11.9-env/lib/python3.11/site-packages/openlane/scripts/base.sdc'…
[INFO] Using clock clk…
[INFO] Setting output delay to: 1
[INFO] Setting input delay to: 1
[INFO] Setting load to: 0.033442
[INFO] Setting clock uncertainty to: 0.25
[INFO] Setting clock transition to: 0.1499999999999999944488848768742172978818416595458984375
[INFO] Setting timing derate to: 5%
[INFO] Setting signal min routing layer to: met1 and clock min routing layer to met1. 
[INFO] Setting signal max routing layer to: met5 and clock max routing layer to met5. 
-congestion_iterations 50 -verbose
[INFO GRT-0020] Min routing layer: met1
[INFO GRT-0021] Max routing layer: met5
[INFO GRT-0022] Global adjustment: 30%
[INFO GRT-0023] Grid origin: (0, 0)
[INFO GRT-0043] No OR_DEFAULT vias defined.
[INFO GRT-0088] Layer li1     Track-Pitch = 0.4600  line-2-Via Pitch: 0.3400
[INFO GRT-0088] Layer met1    Track-Pitch = 0.3400  line-2-Via Pitch: 0.3400
[INFO GRT-0088] Layer met2    Track-Pitch = 0.4600  line-2-Via Pitch: 0.3500
[INFO GRT-0088] Layer met3    Track-Pitch = 0.6800  line-2-Via Pitch: 0.6150
[INFO GRT-0088] Layer met4    Track-Pitch = 0.9200  line-2-Via Pitch: 1.0400
[INFO GRT-0088] Layer met5    Track-Pitch = 3.4000  line-2-Via Pitch: 3.1100
[INFO GRT-0019] Found 4 clock nets.
[INFO GRT-0001] Minimum degree: 2
[INFO GRT-0002] Maximum degree: 9
[INFO GRT-0003] Macros: 0
[INFO GRT-0043] No OR_DEFAULT vias defined.
[INFO GRT-0004] Blockages: 112

[INFO GRT-0053] Routing resources analysis:
          Routing      Original      Derated      Resource
Layer     Direction    Resources     Resources    Reduction (%)
---------------------------------------------------------------
li1        Vertical            0             0          0.00%
met1       Horizontal        700           326          53.43%
met2       Vertical          639           348          45.54%
met3       Horizontal        350           204          41.71%
met4       Vertical          271           138          49.08%
met5       Horizontal         66            28          57.58%
---------------------------------------------------------------

[INFO GRT-0197] Via related to pin nodes: 311
[INFO GRT-0198] Via related Steiner nodes: 2
[INFO GRT-0199] Via filling finished.
[INFO GRT-0111] Final number of vias: 382
[INFO GRT-0112] Final usage 3D: 1290

[INFO GRT-0096] Final congestion report:
Layer         Resource        Demand        Usage (%)    Max H / Max V / Total Overflow
---------------------------------------------------------------------------------------
li1                  0             0            0.00%             0 /  0 /  0
met1               326            64           19.63%             0 /  0 /  0
met2               348            66           18.97%             0 /  0 /  0
met3               204            14            6.86%             0 /  0 /  0
met4               138             0            0.00%             0 /  0 /  0
met5                28             0            0.00%             0 /  0 /  0
---------------------------------------------------------------------------------------
Total             1044           144           13.79%             0 /  0 /  0

[INFO GRT-0018] Total wirelength: 1787 um
[INFO GRT-0014] Routed nets: 81
[INFO GRT-0006] Repairing antennas, iteration 1.
[INFO GRT-0043] No OR_DEFAULT vias defined.
[INFO GRT-0012] Found 0 antenna violations.
Placement Analysis
---------------------------------
total displacement          0.0 u
average displacement        0.0 u
max displacement            0.0 u
original HPWL            1058.5 u
legalized HPWL           1113.1 u
delta HPWL                    5 %

[INFO DPL-0020] Mirrored 33 instances
[INFO DPL-0021] HPWL before            1113.1 u
[INFO DPL-0022] HPWL after             1058.5 u
[INFO DPL-0023] HPWL delta               -4.9 %
-congestion_iterations 50 -verbose
[INFO GRT-0020] Min routing layer: met1
[INFO GRT-0021] Max routing layer: met5
[INFO GRT-0022] Global adjustment: 30%
[INFO GRT-0023] Grid origin: (0, 0)
[INFO GRT-0043] No OR_DEFAULT vias defined.
[INFO GRT-0088] Layer li1     Track-Pitch = 0.4600  line-2-Via Pitch: 0.3400
[INFO GRT-0088] Layer met1    Track-Pitch = 0.3400  line-2-Via Pitch: 0.3400
[INFO GRT-0088] Layer met2    Track-Pitch = 0.4600  line-2-Via Pitch: 0.3500
[INFO GRT-0088] Layer met3    Track-Pitch = 0.6800  line-2-Via Pitch: 0.6150
[INFO GRT-0088] Layer met4    Track-Pitch = 0.9200  line-2-Via Pitch: 1.0400
[INFO GRT-0088] Layer met5    Track-Pitch = 3.4000  line-2-Via Pitch: 3.1100
[INFO GRT-0019] Found 4 clock nets.
[INFO GRT-0001] Minimum degree: 2
[INFO GRT-0002] Maximum degree: 9
[INFO GRT-0003] Macros: 0
[INFO GRT-0043] No OR_DEFAULT vias defined.
[INFO GRT-0004] Blockages: 112

[INFO GRT-0053] Routing resources analysis:
          Routing      Original      Derated      Resource
Layer     Direction    Resources     Resources    Reduction (%)
---------------------------------------------------------------
li1        Vertical            0             0          0.00%
met1       Horizontal        700           326          53.43%
met2       Vertical          639           348          45.54%
met3       Horizontal        350           204          41.71%
met4       Vertical          271           138          49.08%
met5       Horizontal         66            28          57.58%
---------------------------------------------------------------

[INFO GRT-0197] Via related to pin nodes: 311
[INFO GRT-0198] Via related Steiner nodes: 2
[INFO GRT-0199] Via filling finished.
[INFO GRT-0111] Final number of vias: 382
[INFO GRT-0112] Final usage 3D: 1290

[INFO GRT-0096] Final congestion report:
Layer         Resource        Demand        Usage (%)    Max H / Max V / Total Overflow
---------------------------------------------------------------------------------------
li1                  0             0            0.00%             0 /  0 /  0
met1               326            64           19.63%             0 /  0 /  0
met2               348            66           18.97%             0 /  0 /  0
met3               204            14            6.86%             0 /  0 /  0
met4               138             0            0.00%             0 /  0 /  0
met5                28             0            0.00%             0 /  0 /  0
---------------------------------------------------------------------------------------
Total             1044           144           13.79%             0 /  0 /  0

[INFO GRT-0018] Total wirelength: 1787 um
[INFO GRT-0014] Routed nets: 81
[INFO] Setting RC values…
Setting global connections for newly added cells…
[INFO] Setting global connections...
Updating metrics…
Cell type report:                       Count       Area
  Fill cell                                20      75.07
  Tap cell                                 12      15.01
  Buffer                                    4      15.01
  Clock buffer                              3      75.07
  Timing Repair Buffer                     28     166.41
  Inverter                                 11      41.29
  Sequential cell                           8     200.19
  Multi-Input combinational cell           16     121.37
  Total                                   102     709.43
Writing OpenROAD database to '/home/g/my_designs/eth_phy_1g/runs/RUN_2026-02-12_20-25-23/37-openroad-repairantennas/1-diodeinsertion/eth_phy_1g.odb'…
Writing layout to '/home/g/my_designs/eth_phy_1g/runs/RUN_2026-02-12_20-25-23/37-openroad-repairantennas/1-diodeinsertion/eth_phy_1g.def'…
